{
  "schema_version": 1,
  "profile": "alice-meynell",
  "slot": "en.essay",
  "pooled": false,
  "metrics": {
    "sentence_length_sd": {
      "value": 13.288727,
      "overshoot": 1.61,
      "shortfall": 0.61,
      "primary": false
    },
    "sentences_per_paragraph": {
      "value": 7.770833,
      "overshoot": 1.88,
      "shortfall": 0.43,
      "primary": false
    },
    "long_sentence_share": {
      "value": 0.218499,
      "overshoot": 1.65,
      "shortfall": 0.49,
      "primary": false
    },
    "sentence_length_mean": {
      "value": 20.960456,
      "overshoot": 1.33,
      "shortfall": 0.76,
      "primary": false
    },
    "commas_per_sentence": {
      "value": 1.47319,
      "overshoot": 1.48,
      "shortfall": 0.62,
      "primary": false
    },
    "semicolons_per_1k": {
      "value": 7.642375,
      "overshoot": 1.94,
      "shortfall": 0.29,
      "primary": false
    },
    "conjunction_opener_share": {
      "value": 0.134048,
      "overshoot": 2.25,
      "shortfall": 0.05,
      "primary": false
    },
    "contractions_per_1k": {
      "value": 3.581364,
      "overshoot": 2.77,
      "shortfall": 0.05,
      "primary": false
    },
    "dashes_per_1k": {
      "value": 8.537716,
      "overshoot": 2.69,
      "shortfall": 0.05,
      "primary": false
    },
    "colons_per_1k": {
      "value": 1.694753,
      "overshoot": 4.28,
      "shortfall": 0.05,
      "primary": false
    },
    "short_sentence_share": {
      "value": 0.101877,
      "overshoot": 2.61,
      "shortfall": 0.05,
      "primary": false
    },
    "long_word_share": {
      "value": 0.207783,
      "overshoot": 1.25,
      "shortfall": 0.78,
      "primary": false
    },
    "hedges_per_1k": {
      "value": 4.828446,
      "overshoot": 2.1,
      "shortfall": 0.25,
      "primary": false
    },
    "digits_per_1k": {
      "value": 0.0,
      "overshoot": 2.01,
      "shortfall": 0.32,
      "primary": false
    }
  },
  "counts": {
    "texts": 27,
    "words": 31273
  },
  "confidence": {
    "level": "high",
    "count_level": "high",
    "stability_level": "high",
    "splits": 5
  },
  "seed": 2616234900,
  "metric_list": "contrast",
  "built": "2026-09-26T14:33:44Z",
  "personal_data": "none",
  "contrast": {
    "sample_texts": [
      "258f02315821c9a055ebcfef93a9c33938f830506278d5a4c3de9f9e12eec0b4",
      "5b00765f2308f1f1f86ad5c8ca26c6058c6c618e9a24133b34cb98d87c31e378",
      "7736e72dcc4b96896e4f278d0fabf8d9b107ae2bc3721eadc53d6a5e1f541dbd",
      "78862446789c8306db59de7b4b4e08dda279b137edb3260c58cb814e29b79b23",
      "79a7baf745248631f53c67b507c226363988a240e8e1ebeca5210dee788dcc34",
      "b21dbaf73dddf165a23c627fb04da4b26a7355f9be1dee22727767a10d5dbd5a",
      "efb16dae77ea252e7b4a593d414e464d790cb3aad5a98d7fe757e8994d35c4dd",
      "ffa282db2d67eb5bc8429d768daaad36e441e38952230dd5d48cee8b117ff124"
    ],
    "corpus_words_at_sample": 34230,
    "fresh_context": true
  }
}
