{
  "schema_version": 1,
  "profile": "katharine-fullerton-gerould",
  "slot": "en._",
  "pooled": true,
  "metrics": {
    "sentence_length_sd": {
      "value": 12.607394,
      "overshoot": 1.61,
      "shortfall": 0.61,
      "primary": false
    },
    "sentences_per_paragraph": {
      "value": 8.349206,
      "overshoot": 2.731,
      "shortfall": 0.395,
      "primary": false
    },
    "long_sentence_share": {
      "value": 0.192395,
      "overshoot": 2.079,
      "shortfall": 0.302,
      "primary": false
    },
    "sentence_length_mean": {
      "value": 18.972243,
      "overshoot": 1.412,
      "shortfall": 0.76,
      "primary": false
    },
    "commas_per_sentence": {
      "value": 1.269582,
      "overshoot": 1.61,
      "shortfall": 0.616,
      "primary": false
    },
    "semicolons_per_1k": {
      "value": 10.521675,
      "overshoot": 1.944,
      "shortfall": 0.277,
      "primary": true
    },
    "conjunction_opener_share": {
      "value": 0.114829,
      "overshoot": 2.25,
      "shortfall": 0.05,
      "primary": false
    },
    "contractions_per_1k": {
      "value": 5.15061,
      "overshoot": 2.801,
      "shortfall": 0.05,
      "primary": false
    },
    "dashes_per_1k": {
      "value": 8.056597,
      "overshoot": 2.69,
      "shortfall": 0.05,
      "primary": false
    },
    "colons_per_1k": {
      "value": 3.507225,
      "overshoot": 4.28,
      "shortfall": 0.05,
      "primary": false
    },
    "short_sentence_share": {
      "value": 0.161217,
      "overshoot": 2.61,
      "shortfall": 0.05,
      "primary": false
    },
    "long_word_share": {
      "value": 0.200834,
      "overshoot": 1.25,
      "shortfall": 0.78,
      "primary": false
    },
    "hedges_per_1k": {
      "value": 5.972303,
      "overshoot": 2.272,
      "shortfall": 0.05,
      "primary": false
    },
    "digits_per_1k": {
      "value": 0.380784,
      "overshoot": 2.01,
      "shortfall": 0.32,
      "primary": false
    }
  },
  "counts": {
    "texts": 9,
    "words": 51710
  },
  "confidence": {
    "level": "high",
    "count_level": "high",
    "stability_level": "high",
    "splits": 5
  },
  "seed": 2417451096,
  "metric_list": "contrast",
  "built": "2026-10-11T20:47:11Z",
  "personal_data": "none",
  "contrast": {
    "sample_texts": [
      "1c72556823f517435be3db0db873e6ee5a9e1d23cc208c8298dc2e418f31f13c",
      "4bd363d57494e8a00e1c57a599b27c46c5e5e20635a4ce15fae45bcf0fde983d",
      "5143ea83e3ad00d8aefd02d494f6c48c0c19df3853d27507008d9dd9db9e86ac",
      "59c37e7815d89f043bf55a00e1fc7bd148cb436be586f61c9da043f5bba7010f",
      "978d3cca134844279a6d9ca80dad1569b4a4775faa037cd7d84814e667e960d6",
      "c74c6eda29ce2df101aeed98f96bec0a81c94988f6da2ce3711ee19837ce6ccc",
      "d65060fa1949d662bb901f9bca815a1abcafdaaa3be9a6a95a4e804ae4bcb266",
      "fb65c1ed56ccfd82e26e5004243118e1449877737303b6327d23836b1f4d306d"
    ],
    "corpus_words_at_sample": 51710,
    "fresh_context": true
  }
}
