{
  "schema_version": 1,
  "profile": "robert-cortes-holliday",
  "slot": "en.essay",
  "pooled": false,
  "metrics": {
    "sentence_length_sd": {
      "value": 16.417767,
      "overshoot": 1.61,
      "shortfall": 0.457,
      "primary": false
    },
    "sentences_per_paragraph": {
      "value": 4.861804,
      "overshoot": 2.151,
      "shortfall": 0.43,
      "primary": false
    },
    "long_sentence_share": {
      "value": 0.183182,
      "overshoot": 2.163,
      "shortfall": 0.265,
      "primary": false
    },
    "sentence_length_mean": {
      "value": 19.082906,
      "overshoot": 1.536,
      "shortfall": 0.654,
      "primary": false
    },
    "commas_per_sentence": {
      "value": 1.527438,
      "overshoot": 1.875,
      "shortfall": 0.48,
      "primary": false
    },
    "semicolons_per_1k": {
      "value": 7.34427,
      "overshoot": 2.664,
      "shortfall": 0.05,
      "primary": false
    },
    "conjunction_opener_share": {
      "value": 0.099882,
      "overshoot": 2.446,
      "shortfall": 0.05,
      "primary": false
    },
    "contractions_per_1k": {
      "value": 5.482343,
      "overshoot": 2.77,
      "shortfall": 0.05,
      "primary": false
    },
    "dashes_per_1k": {
      "value": 3.413534,
      "overshoot": 3.264,
      "shortfall": 0.05,
      "primary": false
    },
    "colons_per_1k": {
      "value": 2.461882,
      "overshoot": 4.28,
      "shortfall": 0.05,
      "primary": false
    },
    "short_sentence_share": {
      "value": 0.195815,
      "overshoot": 2.61,
      "shortfall": 0.05,
      "primary": false
    },
    "long_word_share": {
      "value": 0.202681,
      "overshoot": 1.328,
      "shortfall": 0.704,
      "primary": true
    },
    "hedges_per_1k": {
      "value": 4.778948,
      "overshoot": 2.395,
      "shortfall": 0.05,
      "primary": false
    },
    "digits_per_1k": {
      "value": 0.744771,
      "overshoot": 3.472,
      "shortfall": 0.05,
      "primary": true
    }
  },
  "counts": {
    "texts": 21,
    "words": 53103
  },
  "confidence": {
    "level": "high",
    "count_level": "high",
    "stability_level": "high",
    "splits": 5
  },
  "seed": 2483764732,
  "metric_list": "contrast",
  "built": "2026-10-11T20:47:13Z",
  "personal_data": "none",
  "contrast": {
    "sample_texts": [
      "032f5fd0a950d4e03ab2e14ef7046a71c403110c818e84977186ecf856716a4d",
      "2b9fda09c5bef6c39fb31ff2301a89c1d50dfb5fea54e423fda592df2f66eb13",
      "39b4921d4f5fbb1dc1a5a25193330e33ce3aea9e05a428527c81766f4c885734",
      "4799bc50ddf4a5120385cb89a4ac0d1c8e65a781d8052225be79eab760d90fcf",
      "835bd2d323b58a182ebe4f43d0f34c9fbdc5b5f062998be9527dd04ccb8ee827",
      "c4629f5a6ea8084d749bf7c206ff68af0a520f4bc04099943b3db76467e7cd15",
      "c6671560bd1575749f9b0526d73e273a887947d4dae3ba6114df86c1a4458b7b",
      "d40dad10d82c010cfa430b5f4a44bef379dd04d23066c19a2abb94c55590cfad"
    ],
    "corpus_words_at_sample": 53103,
    "fresh_context": true
  }
}
